{
  "built_at": "2026-02-01T09:15:00Z",
  "builder_version": "0.0.0",
  "determinism": {
    "deterministic": true,
    "seed": 20260201
  },
  "dimensions": 384,
  "distance_metric": "COSINE",
  "input_contract_version": "1.0.0",
  "licence": {
    "attribution_required": true,
    "identifier": "GOLDEN-FIXTURE-LICENCE",
    "notes": null,
    "redistribution_permitted": false,
    "url": null
  },
  "manifest_version": "1.0.0",
  "model_artifact": {
    "byte_size": 90210,
    "format": "onnx",
    "sha256": "3b7c1f0b6d5a4e2c9a8b7d6e5f4a3b2c1d0e9f8a7b6c5d4e3f2a1b0c9d8e7f60"
  },
  "model_id": "golden/document-embedding",
  "model_revision": "rev-2026020100000000",
  "normalisation": "L2",
  "profile_id": "golden-profile-v1",
  "quantisation": "FLOAT32",
  "runtime": {
    "execution_providers": [
      "CPU"
    ],
    "family": "golden-runtime",
    "integration": {
      "crate": "ort",
      "version": "0.0.0-golden"
    },
    "pinned_by": "GOLDEN-VERIFICATION-RECORD-0001",
    "tokenizer_library": {
      "crate": "tokenizers",
      "version": "0.0.0-golden"
    },
    "version": "1.0.0"
  },
  "source_release_id": null,
  "tier_selection": {
    "chunk_count": 42,
    "embedded_count": 42,
    "skipped_count": 0,
    "tiers": [
      "TIER_PRIMARY"
    ]
  },
  "tokenizer": {
    "artifact_sha256": "9f8e7d6c5b4a39281706f5e4d3c2b1a09f8e7d6c5b4a39281706f5e4d3c2b1a0",
    "id": "golden-tokenizer",
    "max_tokens": 512,
    "truncation": "RIGHT"
  },
  "vector_file": {
    "byte_size": 64512,
    "count": 42,
    "path": "vectors.usearch",
    "sha256": "c1d2e3f4a5b6c7d8e9f0a1b2c3d4e5f6a7b8c9d0e1f2a3b4c5d6e7f8a9b0c1d2"
  }
}
